企业名称,工作地址,招聘主页,经纬度
佛山市宝诗龙精密五金有限公司,广州天河区天河北体育西路189号城建大厦,https://www.lagou.com/jobs/4816720.html,"113.32742016041935,23.145062808731684"
信必优(深圳)信息技术有限公司,广州天河区天河城太古汇,https://www.lagou.com/jobs/4620362.html,"113.33912451887123,23.14007345064082"
广州至真信息科技有限公司,广州天河区中山大道建工路4号佳都大厦,https://www.lagou.com/jobs/4862969.html,"113.37884264423582,23.130468280587273"
广州天源迪科信息技术有限公司,广州天河区珠江新城花城大道18号建滔广场22楼01单元,https://www.lagou.com/jobs/4912189.html,"113.32378564597124,23.12484028296588"
广州米美科技有限公司,广州天河区金穗路8号星汇国际大厦1202室,https://www.lagou.com/jobs/4722128.html,"113.32294544465854,23.1294947470593"
广东原动力信息科技有限责任公司,广州天河区珠江新城珠江新城临江大道57号中和广场21楼21B单元,https://www.lagou.com/jobs/4134891.html,"113.335413728404,23.119783465694013"
武汉佰钧成技术有限责任公司,广州天河区建中路天河软件园,https://www.lagou.com/jobs/4613031.html,"113.37833949164187,23.130139320112114"
上海华钦信息科技股份有限公司,广州越秀区东风东越秀区东风东路767号东宝大厦,https://www.lagou.com/jobs/4581156.html,"113.31793323138926,23.137846292935574"
信必优(深圳)信息技术有限公司,广州天河区天河城太古汇,https://www.lagou.com/jobs/4877191.html,"113.33912451887123,23.14007345064082"
美的集团股份有限公司,广州番禺区广州南站美的总部大楼,https://www.lagou.com/jobs/4734363.html,"113.3039306005112,23.050723696301475"
航天精一（广东）信息科技有限公司,广州天河区员村科韵路建工路9号502518,https://www.lagou.com/jobs/3759540.html,"113.3789090002672,23.12933701106305"
氪金信息科技（天津）有限公司,广州天河区车陂中山大道中379号联合社区东区6栋楼5层65176518室,https://www.lagou.com/jobs/4768411.html,"113.40949136219155,23.131251201075678"
广州和本健康食品科技股份有限公司,广州天河区光谱西路69号TCL文化产业园一期一楼100,https://www.lagou.com/jobs/4491923.html,"113.44278114415931,23.16586140403864"
广东壹健康科技有限公司,广州天河区中山大道中1101号绿瘦运营中心B栋2楼,https://www.lagou.com/jobs/4312511.html,"113.43076099179532,23.12161823767066"
深圳无界互联科技有限公司,广州番禺区市桥番禺大道天安科技发展大厦714,https://www.lagou.com/jobs/4780111.html,"113.37440087113467,22.984716717987798"
深圳超桌网络科技有限公司,广州天河区林和中信广场资讯商务中心(中天购物城)5楼B19,https://www.lagou.com/jobs/4883592.html,"113.33131690282197,23.14795797510584"
链行天下（广州）区块链研究有限公司,广州越秀区广卫珠江国际大厦17层,https://www.lagou.com/jobs/4858312.html,"113.27407463267625,23.135934180802046"
广州富力地产股份有限公司,广州天河区华夏路10号,https://www.lagou.com/jobs/3116450.html,"113.32829065978028,23.123088424840574"
北京友友天宇系统技术有限公司,广州越秀区岭南文明路49号警察协会9层,https://www.lagou.com/jobs/4836581.html,"113.27696514894187,23.128217553648273"
蓝盾信息安全技术股份有限公司,广州天河区棠下黄埔大道336号御发商务大厦,https://www.lagou.com/jobs/1023751.html,"113.38039436549526,23.125454288678625"
佛山市宝诗龙精密五金有限公司,广州天河区沙河珠江新城冼村路11号保利威座北塔2902,https://www.lagou.com/jobs/4720485.html,"113.33373451244019,23.12759195120082"
武汉佰钧成技术有限责任公司,广州天河区科韵路园区建中路60号科迅大厦,https://www.lagou.com/jobs/4090102.html,"113.37689148604164,23.12932223793473"
上海华钦信息科技股份有限公司,广州天河区天河城太古汇,https://www.lagou.com/jobs/3610275.html,"113.33912451887123,23.14007345064082"
广州智悦网络科技有限公司,广州天河区棠下中山大道建中路59号柏朗奴大厦3楼,https://www.lagou.com/jobs/4523772.html,"113.37797940138678,23.129376081889607"
浙江星飞信息技术有限公司,广州天河区棠下棠下二社新围中心路26号锦达信商务大厦A座305,https://www.lagou.com/jobs/3440940.html,"113.38321875030589,23.129452761110688"
广州市汇聚支付电子科技有限公司,广州天河区体育中心天河路228号广晟大厦11011104室,https://www.lagou.com/jobs/4234281.html,"113.33426615389506,23.138373850068106"
广东开太平信息科技有限责任公司,广州海珠区新滘中路唯品同创汇艾特利微大街2号,https://www.lagou.com/jobs/4879215.html,"113.33889140769317,23.083671452619317"
广州一智通供应链管理有限公司,广州天河区兴华天平架5号空间创意园7楼,https://www.lagou.com/jobs/4399388.html,"113.32583083968449,23.168205427349385"
广东优计划科技有限公司,广州天河区龙口西路1号保利中辰广场A座15楼,https://www.lagou.com/jobs/3803665.html,"113.34350938701326,23.139800392325988"
广州闻乐教育科技有限公司,广州天河区棠下科韵路天河软件园建工路13号703室,https://www.lagou.com/jobs/4913066.html,"113.37875351436315,23.12884680105434"
氪金信息科技（天津）有限公司,广州天河区车陂广州市天河区中山大道中379号联合社区东区6栋楼5层65176518室,https://www.lagou.com/jobs/4643630.html,"113.40949136219155,23.131251201075678"
广东道一信息技术股份有限公司,广州天河区天河公园员村一横路3号华颖轩2楼,https://www.lagou.com/jobs/3405970.html,"113.35927726906533,23.12856816178862"
广州德惟科技有限公司,广州天河区平云路163号平云广场A塔,https://www.lagou.com/jobs/4631385.html,"113.35713325815281,23.12473007948776"
广州华多网络科技有限公司,广州番禺区广州市番禺区南村镇万博商务区万达商业广场北区B1栋,https://www.lagou.com/jobs/4682857.html,"113.38385206557157,23.009998610192387"
北京网尚数字电影院线有限公司,广州海珠区琶洲琶洲大道东28号广州国际采购中心1104,https://www.lagou.com/jobs/4212046.html,"113.37836349077187,23.105314085946546"
广州龙腾出行网络科技股份有限公司,广州越秀区粤能大厦10楼,https://www.lagou.com/jobs/4482469.html,"113.31980292315507,23.14047750216012"
广东道一信息技术股份有限公司,广州天河区天河公园员村一横路3号华颖轩2楼,https://www.lagou.com/jobs/4804415.html,"113.35927726906533,23.12856816178862"
广州市汇聚支付电子科技有限公司,广州天河区体育中心天河路228号广晟大厦11011104室,https://www.lagou.com/jobs/4835572.html,"113.33426615389506,23.138373850068106"
广州市金惟安生物科技有限公司,广州海珠区琶洲新港东路2429号海珠科技大楼6618,https://www.lagou.com/jobs/4914299.html,"113.40614678842299,23.100606646055674"
爱多特（广东）网络技术有限公司,广州越秀区广州大道富力新天地中心45F,https://www.lagou.com/jobs/4867166.html,"113.32103170088887,23.132817365173523"
TCL集团财务有限公司,广州海珠区沙河珠江新城,https://www.lagou.com/jobs/1566989.html,"113.33349096564702,23.125725693998607"
广东原动力信息科技有限责任公司,广州天河区珠江新城珠江新城临江大道57号中和广场21楼21B单元,https://www.lagou.com/jobs/4733776.html,"113.335413728404,23.119783465694013"
武汉佰钧成技术有限责任公司,广州天河区员村天河区,https://www.lagou.com/jobs/4857100.html,"113.36440740020396,23.120595600030125"
白云电气集团有限公司,广州白云区太和北太路1633号白云电气科技大厦,https://www.lagou.com/jobs/4767911.html,"113.3419322302333,23.304452832654093"
广东芯智慧科技有限公司,广州海珠区保利国际广场南塔楼19楼,https://www.lagou.com/jobs/3544842.html,"113.3782447204106,23.108254674535555"
广州竹新软件科技有限公司,广州越秀区豪贤商务大楼,https://www.lagou.com/jobs/4330492.html,"113.27874434541063,23.136354568171342"
广州市悄悄科技有限公司,广州天河区珠江新城,https://www.lagou.com/jobs/3174989.html,"113.33349096564702,23.125725693998607"
讯汇科技（广州）有限公司,广州天河区高德置地广场·冬商场东门,https://www.lagou.com/jobs/4699552.html,"113.33314610077201,23.130808323812246"
深圳美云智数科技有限公司,广州番禺区广州南站附近,https://www.lagou.com/jobs/4680576.html,"113.27501202974678,22.994497357745608"
广州合利宝支付科技有限公司,广州天河区珠江新城珠江东路28号越秀金融大厦40楼,https://www.lagou.com/jobs/4439322.html,"113.33284883081784,23.129745738723223"
上海华钦信息科技股份有限公司,广州天河区石牌太古汇,https://www.lagou.com/jobs/4670510.html,"113.33912451887123,23.14007345064082"
广州深海软件股份有限公司,广州天河区黄埔大道中309号羊城创意产业园308栋,https://www.lagou.com/jobs/4585808.html,"113.39103275061241,23.125228348611834"
广州市骑鹅游信息技术咨询服务有限公司,广州海珠区琶洲保利世界贸易中心E座,https://www.lagou.com/jobs/1932127.html,"113.37414996093123,23.101623936509583"
北京路客互联网科技有限公司,广州海珠区新港UP智谷A3栋,https://www.lagou.com/jobs/3656562.html,"113.33574296725467,23.09293999902387"
广州玖维信息科技有限公司,广州天河区五山五山路,https://www.lagou.com/jobs/4520446.html,"113.3595766742917,23.157838126075717"
浙江星飞信息技术有限公司,广州天河区棠下棠下二社新围中心路26号锦达信商务大厦A座305,https://www.lagou.com/jobs/3401230.html,"113.38321875030589,23.129452761110688"
广州建软科技股份有限公司,广州黄埔区广东软件园,https://www.lagou.com/jobs/1561880.html,"113.4432781873775,23.16855634657683"
武汉佰钧成技术有限责任公司,广州天河区冼村珠江新城,https://www.lagou.com/jobs/4724988.html,"113.33349096564702,23.125725693998607"
厦门市巨龙信息科技有限公司,广州越秀区建设广州市黄华路87号,https://www.lagou.com/jobs/4519899.html,"113.28386932566546,23.14150097902637"
广州合富信息科技有限公司,广州天河区珠江新城珠江新城华成路2号名悦大厦,https://www.lagou.com/jobs/4469304.html,"113.32319116894426,23.126611707157743"
广东省电信规划设计院有限公司,广州天河区华景新城中山大道华景路1号南方通信大厦,https://www.lagou.com/jobs/4504291.html,"113.36393627309974,23.14086420050755"
铂涛信息技术（广州）有限公司,广州海珠区广州市海珠区新滘西路300号铂涛大厦六楼,https://www.lagou.com/jobs/4061289.html,"113.29310608289924,23.080328715433502"
广州业速教育科技有限公司,广州天河区林河中路150160号天誉花园一期6楼,https://www.lagou.com/jobs/3924934.html,"113.33255856944324,23.151784448681113"
广东芯智慧科技有限公司,广州海珠区保利国际广场南塔楼19楼,https://www.lagou.com/jobs/3443390.html,"113.3782447204106,23.108254674535555"
广州市新文溯科技有限公司,广州市市市番禺区大学城州大学城国家数字家庭产业基地A区,https://www.lagou.com/jobs/3479613.html,"113.39221247278063,23.06043952962713"
广州明动软件股份有限公司,广州天河区元岗长湴白沙水路89号长湴创意园A栋,https://www.lagou.com/jobs/3859972.html,"113.35716616128703,23.183434753327887"
武汉佰钧成技术有限责任公司,广州天河区天河软件园建中路60号科迅大厦首层,https://www.lagou.com/jobs/3287389.html,"113.37689148604164,23.12932223793473"
神州数码信息服务股份有限公司,广州天河区琶洲科韵路,https://www.lagou.com/jobs/1645341.html,"113.38637366662881,23.1051234135987"
网易（杭州）有限公司,广州天河区软件园科韵路园区建中路59号东座雅爵商务大厦7楼,https://www.lagou.com/jobs/4731610.html,"113.37807570243234,23.129584699195256"
广州海货电子商务有限公司,广州天河区黄村奥林匹克中心10区309,https://www.lagou.com/jobs/3316604.html,"113.42268596636534,23.129220622646258"
TCL集团财务有限公司,广州越秀区岭南广州市越秀区长堤大马路252256号首层后座,https://www.lagou.com/jobs/4229255.html,"113.26986344202315,23.118487961571017"
广州优投互联网金融信息服务有限公司,广州天河区珠江新城广州市天河区珠江新城华夏路30号富力盈通大厦20092012室,https://www.lagou.com/jobs/4886713.html,"113.32880778012658,23.13170631971388"
广州宸瑞软件科技有限公司,广州海珠区江南大道江南大道中180号1301.1314室,https://www.lagou.com/jobs/3190914.html,"113.28036194031141,23.101910442152622"
广州海汇铭康信息技术有限公司,广州天河区五山五山路金慧街88号11栋102单元,https://www.lagou.com/jobs/3147568.html,"113.36341860748198,23.166742563402014"
佳都新太科技股份有限公司,广州番禺区大学城青蓝街22号A区8楼（地铁大学城北C出口）,https://www.lagou.com/jobs/4219752.html,"113.39225879839577,23.06245332781981"
广州合富信息科技有限公司,广州天河区珠江新城珠江新城华成路2号名悦大厦,https://www.lagou.com/jobs/4141705.html,"113.32319116894426,23.126611707157743"
论客科技（广州）有限公司,广州番禺区大学城大学城明志街1号信息枢纽楼5楼,https://www.lagou.com/jobs/4683376.html,"113.40330654582519,23.051434999966542"
大鱼快乐有限公司,广州天河区金发科技创新社区,https://www.lagou.com/jobs/4816865.html,"113.41815337996701,23.19179967144332"
佛山市宝诗龙精密五金有限公司,广州天河区沙河珠江新城冼村路11号保利威座北塔2902,https://www.lagou.com/jobs/4226646.html,"113.33373451244019,23.12759195120082"
广州大白互联网科技有限公司,广州天河区天河城石牌桥地铁站,https://www.lagou.com/jobs/4772300.html,"113.32917331860459,23.13875698808512"
北京智蓝云信科技有限公司,广州天河区五山科韵路天河软件园,https://www.lagou.com/jobs/4807398.html,"113.37833949164187,23.130139320112114"
武汉佰钧成技术有限责任公司,广州天河区科韵路园区建中路60号科迅大厦,https://www.lagou.com/jobs/3490443.html,"113.37689148604164,23.12932223793473"
北京公瑾科技有限公司广州分公司,广州天河区车陂路113号东宏国际广场9楼全层,https://www.lagou.com/jobs/3356513.html,"113.39707842484515,23.12645230265054"
广州微妆生物科技有限公司,广州番禺区广州市番禺区石北工业路684号巨大创意产业园11栋二层,https://www.lagou.com/jobs/3850830.html,"113.29395235765548,23.019764006901603"
广州合富信息科技有限公司,广州天河区珠江新城珠江新城华成路2号名悦大厦,https://www.lagou.com/jobs/4576760.html,"113.32319116894426,23.126611707157743"
广州城市信息研究所有限公司,广州天河区棠下软件园建中路66号佳都商务大厦东座3楼,https://www.lagou.com/jobs/3630371.html,"113.37724967548228,23.128737092361735"
广州明动软件股份有限公司,广州天河区元岗长湴白沙水路89号长湴创意园A栋,https://www.lagou.com/jobs/3832055.html,"113.35716616128703,23.183434753327887"
广东灵机文化传播有限公司,广州天河区东圃广州市天河区黄埔大道中309号羊城创意园308栋三楼A区,https://www.lagou.com/jobs/1487836.html,"113.38970937502029,23.124835482419403"
广州凯晟信息科技有限公司,广州天河区中成路300号中人集团会议中心,https://www.lagou.com/jobs/3841790.html,"113.3496021809632,23.191689931182566"
广州市汇聚支付电子科技有限公司,广州天河区体育中心天河路228号广晟大厦11011104室,https://www.lagou.com/jobs/4597784.html,"113.33426615389506,23.138373850068106"
广州云软数据科技有限公司,广州荔湾区1850创意园,https://www.lagou.com/jobs/4507709.html,"113.24951397999024,23.102214948557265"
深圳美云智数科技有限公司,广州番禺区广州南站附近,https://www.lagou.com/jobs/4664964.html,"113.27501202974678,22.994497357745608"
广东易教优培教育科技有限公司,广州越秀区登峰广州市麓景西路41号广州广播电视大学1号楼18楼,https://www.lagou.com/jobs/4830006.html,"113.2827173153239,23.151750711289846"
广州维胜信息技术有限公司,广州天河区元岗路智汇Park创意园B座505506,https://www.lagou.com/jobs/4010547.html,"113.38341586997541,23.142236491023628"
广州市迈尔汛科技有限公司,广州萝岗区科学城彩频路9号广东软件园B1101C,https://www.lagou.com/jobs/3639489.html,"113.4432781873775,23.16855634657683"
广东曼拓信息科技有限公司,广州天河区五山五山路科华街251号乐天创意园A16001,https://www.lagou.com/jobs/3420454.html,"113.36823651906613,23.15243455058801"
武汉佰钧成技术有限责任公司,广州天河区科韵路园区建中路60号科迅大厦,https://www.lagou.com/jobs/4809758.html,"113.37689148604164,23.12932223793473"
广东灵机文化传播有限公司,广州天河区东圃广州市天河区黄埔大道中309号羊城创意园308栋三楼A区,https://www.lagou.com/jobs/1969309.html,"113.38970937502029,23.124835482419403"
恒腾网络集团有限公司,广州天河区珠江新城黄埔大道西78号恒大中心15楼,https://www.lagou.com/jobs/3290397.html,"113.33391801110325,23.1322236556541"
天涯社区网络科技股份有限公司,广州海珠区新港西路135号中山大学国家大学科技园b座,https://www.lagou.com/jobs/4853831.html,"113.29739170714684,23.099389446506525"
广州聚好玩信息科技有限公司,广州天河区棠下建中路66号佳都商务大厦东塔201,https://www.lagou.com/jobs/4880397.html,"113.37710592054987,23.128612247531937"
信必优(深圳)信息技术有限公司,广州天河区体育中心太古汇,https://www.lagou.com/jobs/4874913.html,"113.33912451887123,23.14007345064082"
广州合利宝支付科技有限公司,广州市天河区沙河珠江东路28号越秀4006金融大厦40层4001,https://www.lagou.com/jobs/1191187.html,"113.3325649869378,23.12998419917455"
广州华多网络科技有限公司,广州番禺区广州市番禺区南村镇万博商务区万达商业广场北区B1栋,https://www.lagou.com/jobs/4743716.html,"113.38385206557157,23.009998610192387"
广州栗梦网络科技有限公司,广州天河区东圃天润大厦506,https://www.lagou.com/jobs/4557928.html,"113.37951214055252,23.126803457189236"
广州合摩计算机科技有限公司,广州天河区建中路59号柏朗奴大厦8楼,https://www.lagou.com/jobs/4027451.html,"113.37797940138678,23.129376081889607"
广东原动力信息科技有限责任公司,广州天河区珠江新城陶育路82号暨南商务中心4楼,https://www.lagou.com/jobs/4018238.html,"113.35142254677345,23.135386462925"
广州光汇软件科技有限公司,广州海珠区广州大道南1601至1603号69号楼之2中地大厦,https://www.lagou.com/jobs/4736602.html,"113.32102526542819,23.080054722886743"
上海华钦信息科技股份有限公司,广州天河区天河路383号太古汇,https://www.lagou.com/jobs/4608759.html,"113.33912451887123,23.14007345064082"
广东省电信规划设计院有限公司,广州天河区五山华景路1号南方通信大厦2302室,https://www.lagou.com/jobs/4778933.html,"113.36393627309974,23.14086420050755"
广州健新科技股份有限公司,广州天河区科韵路20号12楼,https://www.lagou.com/jobs/4216213.html,"113.38034765360877,23.13008473285054"
武汉佰钧成技术有限责任公司,广州越秀区东风东路天联大厦,https://www.lagou.com/jobs/4616081.html,"113.32188973266763,23.135491341280094"
广东灵机文化传播有限公司,广州天河区东圃广州市天河区黄埔大道中309号羊城创意园308栋三楼A区,https://www.lagou.com/jobs/352952.html,"113.38970937502029,23.124835482419403"
信必优(深圳)信息技术有限公司,广州天河区天河城天河区,https://www.lagou.com/jobs/4804687.html,"113.32917331860459,23.13875698808512"
TCL集团财务有限公司,广州越秀区岭南广州市越秀区长堤大马路252256号首层后座,https://www.lagou.com/jobs/4229281.html,"113.26986344202315,23.118487961571017"
广州千翼信息技术有限公司,广州萝岗区广东软件园,https://www.lagou.com/jobs/3300105.html,"113.4432781873775,23.16855634657683"
深圳市周转花科技有限公司,广州白云区现象广场,https://www.lagou.com/jobs/4728346.html,"113.33130628641301,23.29451408301385"
北京睿帆科技有限公司,广州天河区员村新岑四路2号佳都智慧大厦,https://www.lagou.com/jobs/4699087.html,"113.36440740020396,23.120595600030125"
广东程丰智运科技有限公司,广州白云区增槎路江南商务酒店院内北大楼8楼805,https://www.lagou.com/jobs/4800671.html,"113.23268460085976,23.176390876119374"
广州铠源信息科技有限公司,广州天河区林和西路9号耀中广场B座3609,https://www.lagou.com/jobs/3441442.html,"113.33020019498865,23.148563788158977"
广州酷旅旅行社有限公司,广州天河区科韵路20号软银数码港大厦701室,https://www.lagou.com/jobs/4522760.html,"113.38028066067876,23.13018061224485"
广州富力地产股份有限公司,广州天河区珠江新城珠江新城华夏路10号富力中心35楼,https://www.lagou.com/jobs/2601509.html,"113.3283178443016,23.123282238767167"
广州思迈特软件有限公司,广州天河区高普路136号华天时代大厦三楼305,https://www.lagou.com/jobs/4161472.html,"113.41709250451602,23.178531232013576"
广州卓勤信息技术有限公司,广州白云区江高广花三路336号,https://www.lagou.com/jobs/4795486.html,"113.33130628641301,23.29451408301385"
泛华保险服务销售集团有限公司,广州天河区珠江西路15号珠江城大厦27层,https://www.lagou.com/jobs/3956477.html,"113.32945038566785,23.13002433380578"
氪金信息科技（天津）有限公司,广州天河区车陂中山大道中379号联合社区东区6栋楼5层65176518室,https://www.lagou.com/jobs/4764387.html,"113.40949136219155,23.131251201075678"
广州乐芃信息科技有限公司,广州天河区石牌五山路248号金山大厦,https://www.lagou.com/jobs/4879421.html,"113.35295654177027,23.149685098258946"
大海国际电子商务（广州）有限公司,广州越秀区水荫水荫路119号星光映景1805室,https://www.lagou.com/jobs/4792422.html,"113.31796345757306,23.148991862247673"
广东省电信规划设计院有限公司,广州天河区五山华景路1号南方通信大厦2302室,https://www.lagou.com/jobs/4779149.html,"113.36393627309974,23.14086420050755"
广州欧科信息技术股份有限公司,广州萝岗区广州市高新技术产业开发区科学城科学大道162号创意大厦B2第14层,https://www.lagou.com/jobs/4308973.html,"113.45710968746272,23.16963499572441"
广州市恒生国际旅行社有限公司,广州海珠区南石头南边路38号1918智能网联产业园内,https://www.lagou.com/jobs/3350623.html,"113.27064411656515,23.082886903998702"
北京瑞友科技股份有限公司,广州天河区天河公园信息港,https://www.lagou.com/jobs/4663964.html,"113.38023730126842,23.131722820238313"
广东数鼎科技有限公司,广州天河区珠江新城珠江新城华夏路26号雅居乐中心1104,https://www.lagou.com/jobs/4310369.html,"113.32841063117601,23.130137431492948"
广州棒谷科技股份有限公司,广州白云区白云大道景泰街机场东门路01号豪泉大厦2楼大厅,https://www.lagou.com/jobs/3470433.html,"113.27812019286114,23.181526400065703"
广州数夫软件科技有限公司,广州天河区棠下科韵路12号之一方圆E时光西座29楼,https://www.lagou.com/jobs/3488128.html,"113.37858509106314,23.132456654183198"
广东亿迅科技有限公司,广州天河区天河区龙怡路117号银汇大厦27楼（华师地铁E出口）,https://www.lagou.com/jobs/4190678.html,"113.35140144378042,23.149666194248542"
恒腾网络集团有限公司,广州天河区珠江新城黄埔大道西78号恒大中心15楼,https://www.lagou.com/jobs/2728503.html,"113.33391801110325,23.1322236556541"
氪金信息科技（天津）有限公司,广州天河区东圃广州市天河区中山大道中379号联合社区东区6栋楼5层65176518室,https://www.lagou.com/jobs/4760857.html,"113.40949136219155,23.131251201075678"
广州指趣科技有限公司,广州天河区东圃东圃大马路8号时代TIT广场B座B701b1,https://www.lagou.com/jobs/4808723.html,"113.4071083768609,23.12701045924783"
广州卓牛信息科技有限公司,广州天河区华强路9号保利克洛维中盈大厦280607单元,https://www.lagou.com/jobs/4297605.html,"113.32622896868635,23.13187097923412"
广州致链科技有限公司,广州海珠区客村广州大道南448号,https://www.lagou.com/jobs/4826062.html,"113.3214210022425,23.10256444401184"
广州讯一佳信息科技有限公司,广州花都区新白云机场南方航空公司总部,https://www.lagou.com/jobs/4868144.html,"113.30888933675519,23.392012168339125"
广州真知码信息科技有限公司,广州天河区珠江新城利通广场,https://www.lagou.com/jobs/4698493.html,"113.33244361328717,23.131538129552432"
广东省出版集团数字出版有限公司,广州越秀区东都大世界州市环市东路472号粤海大厦10楼,https://www.lagou.com/jobs/4885927.html,"113.31071937012935,23.140291846491802"
广州中大凯旋电子科技有限公司,广州番禺区大学城小谷围街青蓝街26号研发楼2楼（地铁4号线C出口，招商证券楼上）,https://www.lagou.com/jobs/4420057.html,"113.39290991717834,23.062834339484247"
