企业名称,工作地址,招聘主页,经纬度
广州纳财电子商务有限公司,广州天河区珠江新城珠江新城高德置地夏广场D10和12,https://www.lagou.com/jobs/4229308.html,"113.32976847205562,23.126201501921834"
上海安硕信息技术股份有限公司,广州天河区0,https://www.lagou.com/jobs/4491820.html,"113.3856428913265,23.166129265424512"
广州空白间网络信息有限公司,广州天河区马场路,https://www.lagou.com/jobs/4871663.html,"113.35005210176925,23.124062392090018"
广东元朔电子科技有限公司,广州萝岗区广州科学城TCL文化产业园二期B112115,https://www.lagou.com/jobs/4368005.html,"113.44278114415931,23.16586140403864"
广州市奥威亚电子科技有限公司,广州天河区员村科学大道中绿地中央广场A1栋13楼,https://www.lagou.com/jobs/3750009.html,"113.43868199645755,23.169384525156115"
广东灵机文化传播有限公司,广州天河区东圃广州市天河区黄埔大道中309号羊城创意园308栋三楼A区,https://www.lagou.com/jobs/1488086.html,"113.38970937502029,23.124835482419403"
广州谦腾信息科技有限公司,广州海珠区琶洲广州市海珠区琶洲大道宝地广场V15,https://www.lagou.com/jobs/4615558.html,"113.34959054341532,23.108297612197678"
广州搜床网络科技有限公司,广州荔湾区七喜创意创业园33栋Xbed中心,https://www.lagou.com/jobs/4349971.html,"113.25126168815595,23.10000704132628"
广州瑞云网络科技有限公司,广州天河区石牌天河东路67号A幢13层1302单元,https://www.lagou.com/jobs/4119900.html,"113.34035634994545,23.138113720914397"
广州市宏朗商品信息咨询有限公司,广州番禺区市桥市桥大北路99号,https://www.lagou.com/jobs/4248297.html,"113.37256122928517,22.946328756581416"
广东亿迅科技有限公司,广州天河区海珠区阅江西路218、220号广州国际媒体港写字楼（广州塔旁）,https://www.lagou.com/jobs/4905706.html,"113.32798880936629,23.111646607005195"
广州艾得仕网络科技有限公司,广州天河区沙河珠江新城华夏路28号富力盈信大厦,https://www.lagou.com/jobs/4911113.html,"113.32845394926429,23.131014216997972"
广州市巴图鲁信息科技有限公司,广州海珠区南洲沥滘路368号广州之窗商务港17层（三号线沥滘地铁站，F出口）,https://www.lagou.com/jobs/2520025.html,"113.31951162603421,23.060067923853463"
广州棒谷科技股份有限公司,广州白云区白云大道景泰街机场东门路01号豪泉大厦2楼大厅,https://www.lagou.com/jobs/4893047.html,"113.27812019286114,23.181526400065703"
广州美亚尚途国际旅行社有限公司,广州天河区珠江新城花城大道建滔广场9楼902,https://www.lagou.com/jobs/4071123.html,"113.32378564597124,23.12484028296588"
广东劲天科技有限公司,广州海珠区广州市海珠区琶洲大道东8号广州国际采购中心东塔615,https://www.lagou.com/jobs/4872978.html,"113.37836349077187,23.105314085946546"
中邮消费金融有限公司,广州天河区林和林和东路281号天伦控股大厦,https://www.lagou.com/jobs/4851816.html,"113.33457120227665,23.15440141677471"
广州海汇铭康信息技术有限公司,广州天河区五山五山路金慧街88号11栋102单元,https://www.lagou.com/jobs/4803194.html,"113.36341860748198,23.166742563402014"
广州中大凯旋电子科技有限公司,广州番禺区大学城小谷围街青蓝街26号研发楼2楼（地铁4号线C出口，招商证券楼上）,https://www.lagou.com/jobs/4266307.html,"113.39290991717834,23.062834339484247"
广州思迈特软件有限公司,广州天河区广州市天河区高普路华天时代大厦305室,https://www.lagou.com/jobs/3702672.html,"113.41709250451602,23.178531232013576"
广州聚好玩信息科技有限公司,广州天河区棠下建中路66号佳都商务大厦东塔201,https://www.lagou.com/jobs/4799298.html,"113.37710592054987,23.128612247531937"
广东省南方文化产权交易所股份有限公司,广州越秀区五羊新城广州大道中289号南方报业传媒集团综合楼3楼,https://www.lagou.com/jobs/4807419.html,"113.32101800711966,23.12881658118811"
北京瑞友科技股份有限公司,广州天河区员村建中路4446号天河软件园,https://www.lagou.com/jobs/4703476.html,"113.37833949164187,23.130139320112114"
广州市安发网络科技有限公司,广州天河区石牌桥丰兴广场B座18楼（地铁三号线石牌桥B出口旁边）,https://www.lagou.com/jobs/3869212.html,"113.33987925988927,23.13903541410784"
广州业速教育科技有限公司,广州天河区林河中路150160号天誉花园一期6楼,https://www.lagou.com/jobs/3956147.html,"113.33255856944324,23.151784448681113"
上海维恩孛特信息技术有限公司,广州天河区员村天府路233号华建大厦,https://www.lagou.com/jobs/4871607.html,"113.36815719689302,23.137584614034633"
数码辰星科技发展（北京）有限公司,广州海珠区晓港新港新路135号，中大科技园B座16楼，中大地铁站上,https://www.lagou.com/jobs/4700457.html,"113.29733883468117,23.09926717865872"
北京启明星辰信息安全技术有限公司,广州天河区员村启明星辰大厦,https://www.lagou.com/jobs/4725329.html,"113.36440740020396,23.120595600030125"
广东优计划科技有限公司,广州天河区龙口广州市天河区龙口西路1号保利中辰广场A座15整层,https://www.lagou.com/jobs/4722919.html,"113.34350938701326,23.139800392325988"
德讯科技股份有限公司,广州天河区中山大道西华景路1号南方通信大厦801室,https://www.lagou.com/jobs/4305750.html,"113.36393627309974,23.14086420050755"
武汉佰钧成技术有限责任公司,广州越秀区岭南广州市越秀区东华西路59号移动大厦,https://www.lagou.com/jobs/4283135.html,"113.28642256953425,23.128731163973974"
信必优(深圳)信息技术有限公司,广州天河区天河城天河区,https://www.lagou.com/jobs/3943569.html,"113.32917331860459,23.13875698808512"
广州林邦信息科技有限公司,广州萝岗区科学大道286号七喜大厦6072,https://www.lagou.com/jobs/4130618.html,"113.46495757993783,23.174042560313378"
广东蜂助手网络技术股份有限公司,广州天河区石牌龙口东横街28号丽柏国际酒店23层（天娱广场后面）,https://www.lagou.com/jobs/4338358.html,"113.3458098593896,23.14242909659277"
安徽百得思维信息科技有限公司,广州海珠区赤岗金菊路10号,https://www.lagou.com/jobs/4813201.html,"113.31942980567347,23.1066780868006"
万惠投资管理有限公司,广州天河区珠江新城珠江新城高德置地冬广场H座34楼,https://www.lagou.com/jobs/4813429.html,"113.33379929194541,23.125444250501015"
广州天维信息技术有限公司,广州天河区软件路11号6楼,https://www.lagou.com/jobs/153800.html,"113.41894766169867,23.177185624012647"
广东掏掏汽配科技股份有限公司,广州白云区三元里广园中路383号E区,https://www.lagou.com/jobs/3048917.html,"113.28156818315318,23.166997870134136"
广东省电信规划设计院有限公司,广州天河区华景新城中山大道华景路1号南方通信大厦,https://www.lagou.com/jobs/4557625.html,"113.36393627309974,23.14086420050755"
广东一站网络科技有限公司,广州越秀区东风东东风中路389号壬丰商务大厦15楼一站网,https://www.lagou.com/jobs/4855088.html,"113.2773971144174,23.137782906516637"
广州快塑电子商务有限公司,广州天河区珠江新城珠江东路28号越秀金融大厦609616,https://www.lagou.com/jobs/3400753.html,"113.33284883081784,23.129745738723223"
武汉佰钧成技术有限责任公司,广州天河区员村天河软件园科韵路园区建中路60号,https://www.lagou.com/jobs/3438652.html,"113.37691366250976,23.12932397077903"
广州市恒生国际旅行社有限公司,广州海珠区南石头南边路38号1918智能网联产业园内,https://www.lagou.com/jobs/2740669.html,"113.27064411656515,23.082886903998702"
广州南北电子科技有限公司,广州萝岗区科学城天丰路5号启明大厦二层,https://www.lagou.com/jobs/4152354.html,"113.46822968111277,23.16618545319774"
广州傲银信息科技有限责任公司,广州海珠区琶洲琶洲保利叁悦广场C塔1009,https://www.lagou.com/jobs/4896844.html,"113.39128678602071,23.108080009949692"
广州创变者旅行社有限公司,广州海珠区客村客村赤岗西路288号杨协成电子创意园B24,https://www.lagou.com/jobs/4809514.html,"113.32811675861326,23.095927125984385"
大圣科技股份有限公司,广州荔湾区芳村长堤街1号,https://www.lagou.com/jobs/2826188.html,"113.24886177785122,23.10518844033607"
信必优(深圳)信息技术有限公司,广州天河区天河城太古汇,https://www.lagou.com/jobs/4725189.html,"113.33912451887123,23.14007345064082"
广州康乐富健康管家有限公司,广州天河区长兴路5号B栋二楼8207室,https://www.lagou.com/jobs/3687786.html,"113.35263685100888,23.175670673916013"
广州人资选互联网科技有限公司,广州天河区珠江新城珠江西路15号珠江城大厦4103,https://www.lagou.com/jobs/3433630.html,"113.32945038566785,23.13002433380578"
广州市巴图鲁信息科技有限公司,广州海珠区南洲沥滘路368号广州之窗商务港17层（三号线沥滘地铁站，F出口）,https://www.lagou.com/jobs/278742.html,"113.31951162603421,23.060067923853463"
铂涛信息技术（广州）有限公司,广州海珠区瑞宝新滘西路300号铂涛大厦,https://www.lagou.com/jobs/4394627.html,"113.29310608289924,23.080328715433502"
广州市华越友联科技发展有限公司,广州荔湾区昌华黄沙大道144号大冶有色金属大厦1001,https://www.lagou.com/jobs/3276896.html,"113.23782181783224,23.12360463953321"
广州趣丸网络科技有限公司,广州天河区棠下棠下荷光三横路9号盛达商务园C座34楼,https://www.lagou.com/jobs/3799458.html,"113.38171755154491,23.138575297591345"
佛山市宝诗龙精密五金有限公司,广州天河区沙河珠江新城冼村路11号保利威座北塔2902,https://www.lagou.com/jobs/4800926.html,"113.33373451244019,23.12759195120082"
北京智蓝云信科技有限公司,广州天河区科韵路16号信息港A栋15楼,https://www.lagou.com/jobs/4795896.html,"113.38020667983022,23.13183802233798"
上海中软华腾软件系统有限公司,广州天河区员村广州天河区平云广场,https://www.lagou.com/jobs/4760555.html,"113.35713325815281,23.12473007948776"
广州博鳌纵横网络科技有限公司,广州天河区冼村珠江新城珠江城大厦56楼,https://www.lagou.com/jobs/4345227.html,"113.32945038566785,23.13002433380578"
广东一站网络科技有限公司,广州天河区员村棠下涌东路,https://www.lagou.com/jobs/4786989.html,"113.36440740020396,23.120595600030125"
广州玖维信息科技有限公司,广州天河区五山五山路,https://www.lagou.com/jobs/4520234.html,"113.3595766742917,23.157838126075717"
广州易方信息科技股份有限公司,广州番禺区大学城广州大学城外环西路100号广州国家IC基地605室,https://www.lagou.com/jobs/4832880.html,"113.40587687187157,23.04136104121821"
广州威尔森信息科技有限公司,广州天河区猎德珠江东路12号高德置地H座,https://www.lagou.com/jobs/3391288.html,"113.33978197340257,23.120500456712758"
广州赛森软件开发有限公司,广州海珠区新港新港西路135号中大科技园A座408室,https://www.lagou.com/jobs/4785171.html,"113.29830171218748,23.09923205251988"
大圣科技股份有限公司,广州荔湾区芳村广州市荔湾区长堤街1号,https://www.lagou.com/jobs/1424286.html,"113.24886177785122,23.10518844033607"
广州广电运通信息科技有限公司,广州白云区人和南航信息大楼,https://www.lagou.com/jobs/4158590.html,"113.29950707468987,23.340147853997262"
连尚（北京）网络科技有限公司,广州天河区广州市天河区林和东路285号天安人寿中心,https://www.lagou.com/jobs/4686715.html,"113.33493269696369,23.154552858322116"
重庆气盖世网络科技有限公司,广州天河区沙河广东省广州市天河区珠江新城华明路华普广场西塔913,https://www.lagou.com/jobs/4826094.html,"113.32280325726926,23.12865619699867"
广州碧软信息科技有限公司,广州白云区机场路飞翔公园地铁站附近,https://www.lagou.com/jobs/2753448.html,"113.26399858770645,23.171311439410566"
北京智蓝云信科技有限公司,广州天河区天河科技园建中路4446号6层,https://www.lagou.com/jobs/4795929.html,"113.3785928137956,23.132784241264588"
广州惠侨计算机科技有限公司,广州市越秀区沙河富力东山新天地10楼,https://www.lagou.com/jobs/3675881.html,"113.32106218488632,23.132816560920993"
广州市盈泽信息科技有限公司,广州天河区五山广州市天河区长福路207号长兴智汇商务中心D座301B,https://www.lagou.com/jobs/3052810.html,"113.35503035549704,23.172154679830182"
上海中软华腾软件系统有限公司,广州天河区天河公园科韵路,https://www.lagou.com/jobs/4714613.html,"113.3740759504386,23.133934741654922"
广州久邦世纪科技有限公司,广州越秀区中山三路33号中华国际中心A座16、17楼,https://www.lagou.com/jobs/3512031.html,"113.28826188150603,23.131884371130646"
广东联合电服数据科技股份有限公司,广州越秀区建设华侨新村和平路10号,https://www.lagou.com/jobs/4363800.html,"113.29527591919684,23.143769082256796"
广州华多网络科技有限公司,广州番禺区万博商务区万达广场B1座,https://www.lagou.com/jobs/4823819.html,"113.35521477222835,23.01216154578835"
广州至真信息科技有限公司,广州天河区中山大道建工路4号佳都大厦,https://www.lagou.com/jobs/4872501.html,"113.37884264423582,23.130468280587273"
广州悦信无线科技有限公司,广州萝岗区开创大道2707号万达广场B1栋601602室,https://www.lagou.com/jobs/3492860.html,"113.47328966537076,23.17415018934588"
泛纬咨询（深圳）有限公司,广州天河区信息港大厦,https://www.lagou.com/jobs/4805632.html,"113.3856428913265,23.166129265424512"
广东博安达环境科技有限公司,广州天河区明旭街1号万科云城米酷B1栋608610,https://www.lagou.com/jobs/4868647.html,"113.41313685213635,23.172773166453023"
金锡科技（广州）有限公司,广州越秀区东方宾馆3号楼12楼3208室,https://www.lagou.com/jobs/4271763.html,"113.26579816043909,23.145662211095516"
广州皓云原智信息科技有限公司,广州天河区林和天河东路240号,https://www.lagou.com/jobs/4769397.html,"113.3402377745165,23.143715747677668"
广州太平洋电脑信息咨询有限公司,广州天河区高普路115号,https://www.lagou.com/jobs/4826141.html,"113.42152723849519,23.18178272964785"
广州明动软件股份有限公司,广州天河区元岗长湴白沙水路89号长湴创意园A栋,https://www.lagou.com/jobs/4773632.html,"113.35716616128703,23.183434753327887"
广州大象健康科技有限公司,广州天河区宏太智慧谷,https://www.lagou.com/jobs/4800759.html,"113.42335261774848,23.180259889801977"
广州闻乐教育科技有限公司,广州天河区员村科韵路天河软件园建工路天信楼13号703室,https://www.lagou.com/jobs/3081830.html,"113.37911597794138,23.12878387628191"
品骏控股有限公司,广州海珠区琶洲琶洲万胜广场,https://www.lagou.com/jobs/4488097.html,"113.38888020849247,23.103151530182828"
广州智干电子商务科技有限公司,广州海珠区琶洲大道83号宝地广场16021室,https://www.lagou.com/jobs/4159516.html,"113.34959054341532,23.108297612197678"
北京智蓝云信科技有限公司,广州天河区天河公园天河区科韵路16号信息港A栋15楼,https://www.lagou.com/jobs/4789544.html,"113.38020667983022,23.13183802233798"
广州健云信息技术有限公司,广州越秀区越秀区广州大道中307号富力东山新天地602室,https://www.lagou.com/jobs/4836324.html,"113.32106218488632,23.132816560920993"
广东南方家庭购物有限公司,广州越秀区人民北路686号太平洋影音大厦6层（广东广播电台大院内）,https://www.lagou.com/jobs/4784609.html,"113.26420808692421,23.143574459526853"
广州创发软件开发有限公司,黄村智汇园B406,https://www.lagou.com/jobs/1711642.html,"0,0"
广州华多网络科技有限公司,广州番禺区广州市番禺区万博商务区万达商业广场北区B1栋,https://www.lagou.com/jobs/3789475.html,"113.41679952964883,22.93459079579793"
广州快效信息技术有限公司,广州海珠区琶洲大道保利国际南塔1205,https://www.lagou.com/jobs/4588503.html,"113.35989182591537,23.1068587507384"
广州微乾软件信息科技有限公司,广州越秀区岭南珠江新城临江大道保利中心,https://www.lagou.com/jobs/4706764.html,"113.33349096564702,23.125725693998607"
中兴软创科技股份有限公司,广州番禺区大石石北工业路644号巨大创意产业园19栋3楼,https://www.lagou.com/jobs/4547810.html,"113.29395235765548,23.019764006901603"
广州玖维信息科技有限公司,广州天河区五山五山路,https://www.lagou.com/jobs/4520328.html,"113.3595766742917,23.157838126075717"
广州维朗网络科技有限公司,广州天河区珠江新城广州市天河区金穗路62号侨鑫国际大厦,https://www.lagou.com/jobs/4680101.html,"113.32805136107386,23.128044299732867"
广州大象健康科技有限公司,广州天河区宏太智慧谷,https://www.lagou.com/jobs/4680419.html,"113.42335261774848,23.180259889801977"
广州餐道信息科技有限公司,广州市市市荔湾区芳村芳村大道下市直街一号会馆自编5A25B2单元,https://www.lagou.com/jobs/3566032.html,"113.2421756001121,23.107309474550185"
广东南方网络电视传媒有限公司,广州海珠区官洲国际生物岛寰宇三路36、38号合景星辉广场北塔503,https://www.lagou.com/jobs/4634962.html,"113.37721391483825,23.073456347349364"
京滴信息科技（广州）有限公司,广州天河区体育中心体育东路148号南方证券大厦16楼1605,https://www.lagou.com/jobs/4358292.html,"113.33558101983908,23.144901374587675"
恒拓开源信息科技股份有限公司广州分公司,广州天河区冼村珠江新城无限极保利威座北塔,https://www.lagou.com/jobs/4822996.html,"113.33310522697302,23.127227073203628"
广东优计划科技有限公司,广州天河区龙口西路1号保利中辰广场A座15楼,https://www.lagou.com/jobs/4436198.html,"113.34350938701326,23.139800392325988"
广州中国科学院软件应用技术研究所,广州南沙区南沙区海滨路1121号,https://www.lagou.com/jobs/3539848.html,"113.54762830901058,22.831456166664335"
大圣科技股份有限公司,广州荔湾区芳村广州市荔湾区长堤街1号,https://www.lagou.com/jobs/1422976.html,"113.24886177785122,23.10518844033607"
论客科技（广州）有限公司,广州番禺区大学城州大学城综合信息枢纽楼（电信大楼）东入口五楼,https://www.lagou.com/jobs/4063522.html,"113.40085066839228,23.064408982302982"
氪金信息科技（天津）有限公司,广州天河区车陂中山大道中379号联合社区东区6栋楼5层65176518室,https://www.lagou.com/jobs/4770267.html,"113.40949136219155,23.131251201075678"
广州以大计算机科技有限公司,广州天河区元岗元岗路310号智汇parkA栋（天河客运站D出口）,https://www.lagou.com/jobs/4139976.html,"113.34801799763753,23.180424741621675"
上海游民网络科技有限公司,广州天河区棠下中山大道西汇鑫商业大厦3楼,https://www.lagou.com/jobs/4810758.html,"113.38744435427088,23.13092443474373"
英思达（广州）科技有限公司,广州越秀区解放北越秀公园地铁站C出口,https://www.lagou.com/jobs/4610935.html,"113.27579491647306,23.147805233089723"
广州市坤盛信息科技有限公司,广州天河区五山中山大道西89号华景新城华景软件园A栋11楼北917室,https://www.lagou.com/jobs/4693938.html,"113.3628800032611,23.14106168388106"
大圣科技股份有限公司,广州荔湾区芳村长堤街1号,https://www.lagou.com/jobs/4724876.html,"113.24886177785122,23.10518844033607"
广州明动软件股份有限公司,广州天河区元岗长湴白沙水路89号长湴创意园A栋,https://www.lagou.com/jobs/4817141.html,"113.35716616128703,23.183434753327887"
佛山市宝诗龙精密五金有限公司,广州天河区员村广州市天河区马场路539号18楼,https://www.lagou.com/jobs/4385480.html,"113.34971983832394,23.129480864132276"
广州德惟科技有限公司,广州天河区体育西路城建大厦,https://www.lagou.com/jobs/4854811.html,"113.32742016041935,23.145062808731684"
前海易物（深圳）电子商务有限公司广州分公司,广州海珠区琶洲新港东路1000号保利世贸中心C座2011室,https://www.lagou.com/jobs/4877040.html,"113.3735362520816,23.102665795086697"
广东原动力信息科技有限责任公司,广州天河区珠江新城陶育路82号暨南商务中心4楼,https://www.lagou.com/jobs/4223108.html,"113.35142254677345,23.135386462925"
广州天禧游信息科技有限公司,广州番禺区南村万博上城国际2栋1804（南村万博地铁站7号线）,https://www.lagou.com/jobs/4758895.html,"113.35711327355014,23.007195758711752"
深圳市易聆科信息技术股份有限公司,广州天河区石牌广州市天河区龙口东横街28号丽柏酒店东塔24132416室,https://www.lagou.com/jobs/1879222.html,"113.34668185802244,23.145026845178215"
广州铠源信息科技有限公司,广州天河区林和西路9号耀中广场B座3609,https://www.lagou.com/jobs/4514498.html,"113.33020019498865,23.148563788158977"
广州火鹰信息科技有限公司,广州番禺区南浦万兴一路8号广州凹凸凹电商创意产业园B栋301,https://www.lagou.com/jobs/4269981.html,"113.37421116428222,22.956132815238142"
广州大象健康科技有限公司,广州天河区宏太智慧谷,https://www.lagou.com/jobs/4611614.html,"113.42335261774848,23.180259889801977"
品骏控股有限公司,广州海珠区琶洲琶洲万胜广场,https://www.lagou.com/jobs/3688087.html,"113.38888020849247,23.103151530182828"
广州华资软件技术有限公司,广州天河区棠下建中路12号,https://www.lagou.com/jobs/4911584.html,"113.37782586211075,23.132361108023694"
广州玖维信息科技有限公司,广州天河区天河城天河路,https://www.lagou.com/jobs/4664613.html,"113.32917331860459,23.13875698808512"
广东道一信息技术股份有限公司,广州天河区天河公园员村一横路3号华颖轩2楼,https://www.lagou.com/jobs/4882262.html,"113.35927726906533,23.12856816178862"
广州德惟科技有限公司,广州天河区员村体育西路城建大厦,https://www.lagou.com/jobs/4497498.html,"113.32742016041935,23.145062808731684"
广东健客医药有限公司,广州萝岗区萝岗区科学大道中99号科汇金谷S栋四街4号一楼前台大厅,https://www.lagou.com/jobs/4247602.html,"113.44182679067397,23.17311652254065"
广州纳斯威尔信息技术有限公司,广州越秀区水荫路119号,https://www.lagou.com/jobs/4254992.html,"113.31831307717911,23.14863265072925"
广州虎牙信息科技有限公司,广州番禺区广州市番禺区广州市番禺区万博商务区万达商业广场北区B1栋,https://www.lagou.com/jobs/4859066.html,"113.41679952964883,22.93459079579793"
广州伯纳链信息科技有限公司,广州天河区天河公园黄埔大道中207号伟诚大厦2001,https://www.lagou.com/jobs/4844633.html,"113.37390530383246,23.128005945222018"
广州时刻销销网络科技有限公司,广州白云区同德西槎路聚源街50号园区运营招商中心10楼11楼,https://www.lagou.com/jobs/4073472.html,"113.24427946575139,23.187489963315244"
广东彩搜网络技术股份有限公司,广州天河区珠江新城高德置地冬广场H座,https://www.lagou.com/jobs/2977636.html,"113.33379929194541,23.125444250501015"
北京滴普科技有限公司,广州天河区中泰北塔,https://www.lagou.com/jobs/4784593.html,"113.32902765746789,23.156005160552333"
广州傲银信息科技有限责任公司,广州海珠区琶洲琶洲保利叁悦广场C塔1009,https://www.lagou.com/jobs/4614998.html,"113.39128678602071,23.108080009949692"
广州合富信息科技有限公司,广州天河区珠江新城珠江新城华成路2号名悦大厦,https://www.lagou.com/jobs/4400431.html,"113.32319116894426,23.126611707157743"
深圳来电科技有限公司,广州番禺区大石大石街石北工业路684号巨大创意产业园12栋（东塔）6楼,https://www.lagou.com/jobs/4848025.html,"113.29395235765548,23.019764006901603"
广州云徙科技有限公司,广州黄埔区鱼珠鱼珠地铁站出口（锦田花园旁）鱼珠智谷创业产业园,https://www.lagou.com/jobs/3900963.html,"113.4359453087223,23.104386768549677"
蛮蛮天下（北京）网络科技有限公司,广州天河区员村广州天河区天河软件园建中路60号科迅大厦438,https://www.lagou.com/jobs/3153739.html,"113.37689148604164,23.12932223793473"
广州市巴图鲁信息科技有限公司,广州海珠区广州之窗商务港17楼（地铁3号线沥滘地铁F出口）,https://www.lagou.com/jobs/3825095.html,"113.31951162603421,23.060067923853463"
广州好易电子联行服务有限公司,广州番禺区大学城小谷围街道青蓝街26号研发楼6楼地铁4号线大学城北站地铁口,https://www.lagou.com/jobs/3207502.html,"113.39290991717834,23.062834339484247"
